{
  "after": {
    "load": {
      "unit": "kg",
      "value": 80
    },
    "reps": {
      "max": 10,
      "min": 6,
      "target": 8
    },
    "sets": 2
  },
  "before": {
    "load": {
      "unit": "kg",
      "value": 80
    },
    "reps": {
      "max": 10,
      "min": 6,
      "target": 8
    },
    "sets": 2
  },
  "decisionType": "hold",
  "evidence": {
    "actualSetCount": 1,
    "plannedSetCount": 2
  },
  "exerciseId": "Barbell_Bench_Press_-_Medium_Grip",
  "planId": "p",
  "policyId": "double-progression-v1",
  "policyVersion": "1.0.0",
  "prescriptionId": "bench-rx",
  "provenance": {},
  "reasonCodes": [
    "INCOMPLETE_WORKOUT",
    "SET_TARGET_NOT_COMPLETED"
  ],
  "revisionId": "r",
  "schemaVersion": "0.1.0"
}
